{
    "$schema": "https://raw.githubusercontent.com/Blitz-BS/blitzCollection/refs/heads/feat/BCC-479-Faire-evoluer-le-schema/json_schema/bankAccount.schema.json",
    "name": "John Doe",
    "iban": "FR7630006000011234567890189",
    "bank": "Banque de France",
    "bankCode": "30006",
    "sortCode": "00123",
    "accountNumber": "12345678901",
    "key": "89"
}